<?xml version="1.0" encoding="utf-8"?>
<!DOCTYPE patch SYSTEM "patch.v2.dtd">
<patch version="2">
    <component ref="config-parser">
        <category name="additions">
            <breaking severity="major">
                <entry>config schema validation 4 (config.v4.xsd) with custom versioning phases</entry>
                <entry>config schema parsing for version 4</entry>
            </breaking>
            <entry>config version 4 phase model config classes</entry>
            <entry>phase formatter support, including configurable prefix and suffix placeholders</entry>
            <entry>validation and parsing of optional phase transition event values</entry>
        </category>
    </component>
    <component ref="versioning">
        <category name="refactorings">
            <breaking severity="major">
                <entry>configuration-driven version sources, phases, formatters, and version operations</entry>
                <entry>versioning CLI commands now operate through generic configured operations</entry>
            </breaking>
            <entry>version source resolution across all configured files with version consistency validation</entry>
            <entry>version change-set planning before applying file modifications</entry>
            <entry>shared versioning-model module for passing version values between tools</entry>
        </category>
        <category name="additions">
            <entry>configurable numeric version increments and phase transitions</entry>
            <entry>configurable version formatter placeholders</entry>
            <entry>versioning subsystem tests for formatters, sources, consistency, and change application</entry>
        </category>
    </component>
</patch>
